company_id,company_name,client_name,country,state,city,address,total_emp,status,Add_Date,Modify_Date
1,HSBC Software Development pvt Ltd,NULL,India,Maharashtra,Pune,"HSBC Software Development pvt Ltd, Yerawada, Pune-41",NULL,Active,09-10-2023 11:35:49,09-10-2023 11:35:49
2,Tech Solutions Pvt Ltd,ABC Corp,India,Karnataka,Bangalore,"Tech Solutions Pvt Ltd, Whitefield, Bangalore-66",500,Active,01-08-2023 09:25:30,05-08-2023 14:12:45
3,Global IT Services,XYZ Enterprises,USA,California,San Francisco,"Global IT Services, Market Street, San Francisco, CA-94103",1200,Active,15-07-2023 10:50:22,20-07-2023 16:37:50
4,Innovatech Industries,NULL,Canada,Ontario,Toronto,"Innovatech Industries, Bay Street, Toronto, ON-M5H 2R2",350,Inactive,22-06-2023 08:15:47,30-06-2023 12:45:18
5,Fintech Solutions LLC,DEF Inc,UK,London,London,"Fintech Solutions LLC, Canary Wharf, London-E14 5AB",750,Active,10-09-2023 13:05:11,15-09-2023 09:30:24
6,NextGen Technologies,NULL,Australia,New South Wales,Sydney,"NextGen Technologies, George Street, Sydney, NSW-2000",200,Active,02-07-2023 11:22:33,07-07-2023 10:40:58
7,SecureIT Corp,GHI Ltd,India,Tamil Nadu,Chennai,"SecureIT Corp, OMR Road, Chennai-600097",300,Active,18-08-2023 14:30:00,22-08-2023 11:55:43
8,CyberNetics Inc,JLM Ltd,Germany,Bavaria,Munich,"CyberNetics Inc, Karlplatz, Munich-80335",900,Active,12-05-2023 16:45:29,18-05-2023 12:15:07